{
  "$schema": "https://json-schema.org/draft/2020-12/schema",
  "$id": "https://example.invalid/principia/anomaly-registry.schema.json",
  "title": "Principia Mathematica anomaly register",
  "type": "object",
  "additionalProperties": false,
  "required": ["schema_version", "id", "official_errata_registry", "entries", "infrastructure_incidents"],
  "properties": {
    "schema_version": {"const": 1},
    "id": {"type": "string"},
    "official_errata_registry": {"type": "object"},
    "entries": {
      "type": "array",
      "items": {
        "type": "object",
        "additionalProperties": false,
        "required": [
          "id", "category", "pm_locus", "printed_reading", "printed_citations",
          "corrected_or_added_reading", "canonical_witness_evidence", "digital_witnesses",
          "affected_ast_items_batches", "strict_audit_status", "minimal_relaxation",
          "lean_impact", "review_provenance", "resolution_status"
        ],
        "properties": {
          "id": {"type": "string"},
          "category": {
            "enum": [
              "printed-error-unofficial", "incomplete-printed-citation",
              "notation-ambiguity", "digital-witness-error", "reconstruction-gap",
              "context-polymorphism-gap"
            ]
          },
          "pm_locus": {"type": "object"},
          "printed_reading": {"type": "string"},
          "printed_citations": {"type": "array", "items": {"type": "string"}},
          "corrected_or_added_reading": {"type": "string"},
          "canonical_witness_evidence": {"type": "object"},
          "digital_witnesses": {"type": "array"},
          "affected_ast_items_batches": {"type": "object"},
          "strict_audit_status": {"type": "string"},
          "minimal_relaxation": {"type": "array"},
          "lean_impact": {"type": "object"},
          "review_provenance": {"type": "array", "minItems": 1},
          "resolution_status": {"type": "string"},
          "strict": {"type": "boolean"},
          "relaxation_use": {"type": "array"},
          "resolves": {"type": "array", "items": {"type": "string"}},
          "apparatus_id": {"type": "string"},
          "linked_official_errata_ids": {"type": "array", "items": {"type": "string"}}
        }
      }
    },
    "infrastructure_incidents": {
      "type": "array",
      "items": {
        "type": "object",
        "additionalProperties": false,
        "required": [
          "id", "batch", "service", "project_id", "task_id", "observed_sequence",
          "authoritative_status", "duplicate_submission", "classification",
          "pm_or_reconstruction_impact", "kernel_impact", "provenance", "resolution_status"
        ],
        "properties": {
          "id": {"type": "string"},
          "batch": {"type": "string"},
          "service": {"type": "string"},
          "project_id": {"type": "string"},
          "task_id": {"type": "string"},
          "observed_sequence": {"type": "array", "items": {"type": "string"}},
          "authoritative_status": {"type": "string"},
          "duplicate_submission": {"type": "string"},
          "classification": {"const": "infrastructure-transport-failure"},
          "pm_or_reconstruction_impact": {"const": "none established; this is neither a PM source anomaly nor a reconstruction finding"},
          "kernel_impact": {"type": "string"},
          "provenance": {"type": "array", "minItems": 1, "items": {"type": "string"}},
          "resolution_status": {"type": "string"}
        }
      }
    }
  }
}
