{
  "schema_version": 1,
  "id": "PM1-ANOMALY-REGISTER",
  "official_errata_registry": {
    "id": "PM1-1910-ERRATA",
    "path": "metadata/errata/PM1-1910-errata.json",
    "entry_ids": [
      "PM1-ERRATA-P14-L2-STATES",
      "PM1-ERRATA-P14-L7-REFERENCES",
      "PM1-ERRATA-P15-PENULTIMATE-FUNCTION-OF",
      "PM1-ERRATA-P34-L15-X-R",
      "PM1-ERRATA-P68-L20-CLASSES",
      "PM1-ERRATA-P86-L2-MUST",
      "PM1-ERRATA-P91-L8-AND-3-03",
      "PM1-ERRATA-P103-L7-ASSUMPTION",
      "PM1-ERRATA-P103-L25-Q-R",
      "PM1-ERRATA-P218-PENULTIMATE-DELTA-LAMBDA",
      "PM1-ERRATA-P382-PENULTIMATE-SELECTIONS",
      "PM1-ERRATA-P487-L13-STAR95",
      "PM1-ERRATA-P503-L14-STAR88-38"
    ],
    "policy": "Official Errata are linked here and never duplicated as anomaly entries."
  },
  "entries": [
    {
      "id": "PM1-ANOM-APP-PM1-1.4-PG78050-001",
      "category": "digital-witness-error",
      "pm_locus": {
        "volume": 1,
        "printed_pages": [
          100
        ],
        "scan_leaves": [
          122
        ],
        "items": [
          "PM1:✱1·4"
        ],
        "line_or_formula": "consequent of the displayed primitive proposition"
      },
      "printed_reading": "⊢ : p ∨ q . ⊃ . q ∨ p     Pp.",
      "printed_citations": [],
      "corrected_or_added_reading": "⊢ : p ∨ q . ⊃ . p ∨ p     Pp.",
      "canonical_witness_evidence": {
        "canonical_scan": "https://en.wikisource.org/wiki/Page:Russell,_Whitehead_-_Principia_Mathematica,_vol._I,_1910.djvu/122",
        "scan_leaf": 122,
        "sha256": "3b43a0ae7e18e0431b432256110d71c917deb94b43aaf1f07465f99743349206",
        "hash_kind": "UTF-8 canonical diplomatic reading"
      },
      "digital_witnesses": [
        {
          "siglum": "PG78050",
          "reading": "⊢ : p ∨ q . ⊃ . p ∨ p     Pp.",
          "uri": "https://www.gutenberg.org/files/78050/78050-h/78050-h.htm"
        },
        {
          "siglum": "WS-PM1",
          "reading": "⊢ : p ∨ q . ⊃ . q ∨ p     Pp.",
          "uri": "https://en.wikisource.org/wiki/Russell_%26_Whitehead%27s_Principia_Mathematica/Part_1/Section_A"
        }
      ],
      "affected_ast_items_batches": {
        "items": [
          "PM1:✱1·4"
        ],
        "batches": [],
        "ast_effect": "None unless a separately reviewed item audit says otherwise."
      },
      "strict_audit_status": "not-applicable: witness collation only",
      "minimal_relaxation": [],
      "lean_impact": {
        "kind": "canonical-source-preserved",
        "status": "no-PM-emendation"
      },
      "review_provenance": [
        "metadata/apparatus/PM1-star-1-4-pg78050.json"
      ],
      "resolution_status": "recorded-in-apparatus",
      "apparatus_id": "APP-PM1-1.4-PG78050-001",
      "linked_official_errata_ids": []
    },
    {
      "id": "PM1-ANOM-APP-PM1-3.34-WS-OPENING-BRACKET-001",
      "category": "digital-witness-error",
      "pm_locus": {
        "volume": 1,
        "printed_pages": [
          118
        ],
        "scan_leaves": [
          140
        ],
        "items": [
          "PM1:✱3·34"
        ],
        "line_or_formula": "bracketed Syll.Imp citation following the displayed proposition"
      },
      "printed_reading": "✱3·34.  ⊢ : q ⊃ r . p ⊃ q . ⊃ . p ⊃ r     [Syll.Imp]",
      "printed_citations": [],
      "corrected_or_added_reading": "✱3·34.  ⊢ : q ⊃ r . p ⊃ q . ⊃ . p ⊃ r     Syll.Imp]",
      "canonical_witness_evidence": {
        "canonical_scan": "https://en.wikisource.org/wiki/Page:Russell,_Whitehead_-_Principia_Mathematica,_vol._I,_1910.djvu/140",
        "scan_leaf": 140,
        "sha256": "13d42cd5c71f55a1ac8eb79873894e3bff077ea54912d732ede876fc5122bf9e",
        "hash_kind": "UTF-8 canonical diplomatic reading"
      },
      "digital_witnesses": [
        {
          "siglum": "WS-PM1",
          "reading": "Syll.Imp]",
          "uri": "https://en.wikisource.org/wiki/Page:Russell,_Whitehead_-_Principia_Mathematica,_vol._I,_1910.djvu/140"
        }
      ],
      "affected_ast_items_batches": {
        "items": [
          "PM1:✱3·34"
        ],
        "batches": [],
        "ast_effect": "None unless a separately reviewed item audit says otherwise."
      },
      "strict_audit_status": "not-applicable: witness collation only",
      "minimal_relaxation": [],
      "lean_impact": {
        "kind": "canonical-source-preserved",
        "status": "no-PM-emendation"
      },
      "review_provenance": [
        "metadata/apparatus/PM1-star-3-34-ws-opening-bracket.json"
      ],
      "resolution_status": "recorded-in-apparatus",
      "apparatus_id": "APP-PM1-3.34-WS-OPENING-BRACKET-001",
      "linked_official_errata_ids": []
    },
    {
      "id": "PM1-ANOM-APP-PM1-INTRO-P10-PG-001",
      "category": "digital-witness-error",
      "pm_locus": {
        "volume": 1,
        "printed_pages": [
          10
        ],
        "scan_leaves": [
          32
        ],
        "items": [
          "PM1:INTRODUCTION-CH1-PP4-10"
        ],
        "line_or_formula": "first Group II example continued from p. 9"
      },
      "printed_reading": "(∃x, y)",
      "printed_citations": [],
      "corrected_or_added_reading": "(∃x, ∼y)",
      "canonical_witness_evidence": {
        "canonical_scan": "https://en.wikisource.org/wiki/Page:Russell,_Whitehead_-_Principia_Mathematica,_vol._I,_1910.djvu/32",
        "scan_leaf": 32,
        "sha256": "aeea4fc70ca7db28a47311cd241c05978c11b514743d2fc1d7e46fc2970b8636",
        "hash_kind": "UTF-8 canonical diplomatic reading"
      },
      "digital_witnesses": [
        {
          "siglum": "PG78050",
          "reading": "(∃x, ∼y)",
          "uri": "https://www.gutenberg.org/files/78050/78050-src/78050-src.htm"
        },
        {
          "siglum": "WS-PM1",
          "reading": "(∃x, y)",
          "uri": "https://en.wikisource.org/w/index.php?title=Page:Russell,_Whitehead_-_Principia_Mathematica,_vol._I,_1910.djvu/32&action=raw"
        }
      ],
      "affected_ast_items_batches": {
        "items": [
          "PM1:INTRODUCTION-CH1-PP4-10"
        ],
        "batches": [],
        "ast_effect": "None unless a separately reviewed item audit says otherwise."
      },
      "strict_audit_status": "not-applicable: witness collation only",
      "minimal_relaxation": [],
      "lean_impact": {
        "kind": "canonical-source-preserved",
        "status": "no-PM-emendation"
      },
      "review_provenance": [
        "metadata/apparatus/PM1-introduction-p10-pg-neg-y.json"
      ],
      "resolution_status": "recorded-in-apparatus",
      "apparatus_id": "APP-PM1-INTRO-P10-PG-001",
      "linked_official_errata_ids": []
    },
    {
      "id": "PM1-ANOM-APP-PM1-INTRO-P10-WS-002",
      "category": "digital-witness-error",
      "pm_locus": {
        "volume": 1,
        "printed_pages": [
          10
        ],
        "scan_leaves": [
          32
        ],
        "items": [
          "PM1:INTRODUCTION-CH1-PP4-10"
        ],
        "line_or_formula": "sentence introducing dot examples"
      },
      "printed_reading": "illustrate the use of dots",
      "printed_citations": [],
      "corrected_or_added_reading": "illustrate the use.of dots",
      "canonical_witness_evidence": {
        "canonical_scan": "https://en.wikisource.org/wiki/Page:Russell,_Whitehead_-_Principia_Mathematica,_vol._I,_1910.djvu/32",
        "scan_leaf": 32,
        "sha256": "e406ea19fb7be46fff2e94dd6e90aa6c2691ebb3f2cb56ced2585f0c7a5efdbb",
        "hash_kind": "UTF-8 canonical diplomatic reading"
      },
      "digital_witnesses": [
        {
          "siglum": "PG78050",
          "reading": "illustrate the use of dots",
          "uri": "https://www.gutenberg.org/files/78050/78050-src/78050-src.htm"
        },
        {
          "siglum": "WS-PM1",
          "reading": "illustrate the use.of dots",
          "uri": "https://en.wikisource.org/w/index.php?title=Page:Russell,_Whitehead_-_Principia_Mathematica,_vol._I,_1910.djvu/32&action=raw"
        }
      ],
      "affected_ast_items_batches": {
        "items": [
          "PM1:INTRODUCTION-CH1-PP4-10"
        ],
        "batches": [],
        "ast_effect": "None unless a separately reviewed item audit says otherwise."
      },
      "strict_audit_status": "not-applicable: witness collation only",
      "minimal_relaxation": [],
      "lean_impact": {
        "kind": "canonical-source-preserved",
        "status": "no-PM-emendation"
      },
      "review_provenance": [
        "metadata/apparatus/PM1-introduction-p10-ws-use-of.json"
      ],
      "resolution_status": "recorded-in-apparatus",
      "apparatus_id": "APP-PM1-INTRO-P10-WS-002",
      "linked_official_errata_ids": []
    },
    {
      "id": "PM1-ANOM-APP-PM1-INTRO-P12-WS-PRODUCT-001",
      "category": "digital-witness-error",
      "pm_locus": {
        "volume": 1,
        "printed_pages": [
          12
        ],
        "scan_leaves": [
          34
        ],
        "items": [
          "PM1:INTRODUCTION-CH1-DEFINITIONS-PP11-12"
        ],
        "line_or_formula": "first formula under ‘Three definitions have been introduced’"
      },
      "printed_reading": "p · q .=. ∼(∼p ∨ ∼q) Df",
      "printed_citations": [],
      "corrected_or_added_reading": "p ∨ q .=. ∼(∼p ∨ ∼q) Df",
      "canonical_witness_evidence": {
        "canonical_scan": "https://en.wikisource.org/wiki/Page:Russell,_Whitehead_-_Principia_Mathematica,_vol._I,_1910.djvu/34",
        "scan_leaf": 34,
        "sha256": "6989ac95cf01b5d3368b8fa4dfaed979a91e8bfc8b8f0105132560012d7a59fb",
        "hash_kind": "UTF-8 canonical diplomatic reading"
      },
      "digital_witnesses": [
        {
          "siglum": "WS-PM1",
          "reading": "p ∨ q .=. ∼(∼p ∨ ∼q) Df",
          "uri": "https://en.wikisource.org/wiki/Page:Russell,_Whitehead_-_Principia_Mathematica,_vol._I,_1910.djvu/34"
        },
        {
          "siglum": "PG78050",
          "reading": "p · q .=. ∼(∼p ∨ ∼q) Df",